{
  "contract": {
    "name": "refusal_attestation",
    "version": "v2alpha1"
  },
  "external_anchors": [],
  "signature": {
    "algorithm": "EdDSA",
    "encoding": "base64url",
    "key_id": "kid_cloud_invoice_v1_outcome_001",
    "value": "ApUnsY-PJvpN7xesh4yukXjpsswzgD3lwuTZEPL2byHFcTsPfh_rBqur44f_rlsxfG-cWALlS4eiBypkHMG9CA"
  },
  "unsigned_payload": {
    "artifact_digest": {
      "algorithm": "sha-256",
      "value": "a58d4b76024830670ce244f173195fb4542aba83c054723a570a5db4123b8cc8"
    },
    "artifact_type": "refusal",
    "attestation_id": "att_refusal_cloud_invoice_v1",
    "issued_at": "2026-01-15T12:02:00Z",
    "issuer": {
      "display_name": "Actenon Cloud",
      "id": "https://actenon-cloud.local/issuer",
      "type": "service"
    },
    "metadata": {
      "pass": "keystone_pass_4",
      "vector_id": "cloud_invoice_payment_v1"
    },
    "outcome_artifact": {
      "capability": "finance.transfer.release",
      "contract": {
        "name": "refusal",
        "version": "v1"
      },
      "issued_at": "2026-01-15T12:01:00Z",
      "metadata": {
        "pass": "keystone_pass_4",
        "vector_id": "cloud_invoice_payment_v1"
      },
      "outcome": "refused",
      "proof_binding": {
        "action_hash": "ff83a7e14dfbc6e2b361e8a9a4a802b5ba5a96ba26aa19f76bb23230da8ced24",
        "intent_id": "intent_cloud_invoice_v1",
        "pccb_id": "pccb_proof_cloud_invoice_v1"
      },
      "reason_code": "VECTOR_RESERVED_REFUSAL",
      "refusal_id": "refusal_cloud_invoice_v1"
    },
    "proof_binding": {
      "action_hash": "ff83a7e14dfbc6e2b361e8a9a4a802b5ba5a96ba26aa19f76bb23230da8ced24",
      "intent_id": "intent_cloud_invoice_v1",
      "pccb_id": "pccb_proof_cloud_invoice_v1"
    }
  }
}
